<?xml version="1.0" encoding="UTF-8"?>
<!--Sample XML file generated by XMLSpy v2019 rel. 3 (x64) (http://www.altova.com)-->
<root xmlns:xsi="http://www.w3.org/2001/XMLSchema-instance" xsi:noNamespaceSchemaLocation="file:///E:/repos/GitHub/biotoolsShim/genericxml2xml-singletool/versions/biotools-3.3.0/biotools-3.3.0_framework_singletool.xsd">
	<name>String</name>
	<description>String</description>
	<homepage>http://www.altova.com/</homepage>
	<biotoolsID>String</biotoolsID>
	<biotoolsCURIE>String</biotoolsCURIE>
	<version>
		<list-item>String</list-item>
		<list-item>String</list-item>
	</version>
	<otherID>
		<list-item>
			<value>String</value>
			<type>String</type>
			<version>String</version>
		</list-item>
		<list-item>
			<value>String</value>
			<type>String</type>
			<version>String</version>
		</list-item>
	</otherID>
	<function>
		<list-item>
			<operation>
				<list-item>
					<uri>http://www.altova.com/</uri>
					<term>String</term>
				</list-item>
				<list-item>
					<uri>http://www.altova.com/</uri>
					<term>String</term>
				</list-item>
			</operation>
			<input>
				<list-item>
					<data>
						<uri>http://www.altova.com/</uri>
						<term>String</term>
					</data>
					<format>
						<list-item>
							<uri>http://www.altova.com/</uri>
							<term>String</term>
						</list-item>
						<list-item>
							<uri>http://www.altova.com/</uri>
							<term>String</term>
						</list-item>
					</format>
				</list-item>
				<list-item>
					<data>
						<uri>http://www.altova.com/</uri>
						<term>String</term>
					</data>
					<format>
						<list-item>
							<uri>http://www.altova.com/</uri>
							<term>String</term>
						</list-item>
						<list-item>
							<uri>http://www.altova.com/</uri>
							<term>String</term>
						</list-item>
					</format>
				</list-item>
			</input>
			<output>
				<list-item>
					<data>
						<uri>http://www.altova.com/</uri>
						<term>String</term>
					</data>
					<format>
						<list-item>
							<uri>http://www.altova.com/</uri>
							<term>String</term>
						</list-item>
						<list-item>
							<uri>http://www.altova.com/</uri>
							<term>String</term>
						</list-item>
					</format>
				</list-item>
				<list-item>
					<data>
						<uri>http://www.altova.com/</uri>
						<term>String</term>
					</data>
					<format>
						<list-item>
							<uri>http://www.altova.com/</uri>
							<term>String</term>
						</list-item>
						<list-item>
							<uri>http://www.altova.com/</uri>
							<term>String</term>
						</list-item>
					</format>
				</list-item>
			</output>
			<note>String</note>
			<cmd>String</cmd>
		</list-item>
		<list-item>
			<operation>
				<list-item>
					<uri>http://www.altova.com/</uri>
					<term>String</term>
				</list-item>
				<list-item>
					<uri>http://www.altova.com/</uri>
					<term>String</term>
				</list-item>
			</operation>
			<input>
				<list-item>
					<data>
						<uri>http://www.altova.com/</uri>
						<term>String</term>
					</data>
					<format>
						<list-item>
							<uri>http://www.altova.com/</uri>
							<term>String</term>
						</list-item>
						<list-item>
							<uri>http://www.altova.com/</uri>
							<term>String</term>
						</list-item>
					</format>
				</list-item>
				<list-item>
					<data>
						<uri>http://www.altova.com/</uri>
						<term>String</term>
					</data>
					<format>
						<list-item>
							<uri>http://www.altova.com/</uri>
							<term>String</term>
						</list-item>
						<list-item>
							<uri>http://www.altova.com/</uri>
							<term>String</term>
						</list-item>
					</format>
				</list-item>
			</input>
			<output>
				<list-item>
					<data>
						<uri>http://www.altova.com/</uri>
						<term>String</term>
					</data>
					<format>
						<list-item>
							<uri>http://www.altova.com/</uri>
							<term>String</term>
						</list-item>
						<list-item>
							<uri>http://www.altova.com/</uri>
							<term>String</term>
						</list-item>
					</format>
				</list-item>
				<list-item>
					<data>
						<uri>http://www.altova.com/</uri>
						<term>String</term>
					</data>
					<format>
						<list-item>
							<uri>http://www.altova.com/</uri>
							<term>String</term>
						</list-item>
						<list-item>
							<uri>http://www.altova.com/</uri>
							<term>String</term>
						</list-item>
					</format>
				</list-item>
			</output>
			<note>String</note>
			<cmd>String</cmd>
		</list-item>
	</function>
	<toolType>
		<list-item>String</list-item>
		<list-item>String</list-item>
	</toolType>
	<topic>
		<list-item>
			<uri>http://www.altova.com/</uri>
			<term>String</term>
		</list-item>
		<list-item>
			<uri>http://www.altova.com/</uri>
			<term>String</term>
		</list-item>
	</topic>
	<operatingSystem>
		<list-item>String</list-item>
		<list-item>String</list-item>
	</operatingSystem>
	<language>
		<list-item>String</list-item>
		<list-item>String</list-item>
	</language>
	<license>String</license>
	<collectionID>
		<list-item>String</list-item>
		<list-item>String</list-item>
	</collectionID>
	<maturity>String</maturity>
	<cost>String</cost>
	<accessibility>text</accessibility>
	<elixirPlatform>
		<list-item>String</list-item>
		<list-item>String</list-item>
	</elixirPlatform>
	<elixirCommunity>
		<list-item>String</list-item>
		<list-item>String</list-item>
	</elixirCommunity>
	<elixirNode>
		<list-item>String</list-item>
		<list-item>String</list-item>
	</elixirNode>
	<link>
		<list-item>
			<url>http://www.altova.com/</url>
			<type>
				<list-item>String</list-item>
				<list-item>String</list-item>
			</type>
			<note>String</note>
		</list-item>
		<list-item>
			<url>http://www.altova.com/</url>
			<type>
				<list-item>String</list-item>
				<list-item>String</list-item>
			</type>
			<note>String</note>
		</list-item>
	</link>
	<download>
		<list-item>
			<url>http://www.altova.com/</url>
			<type>String</type>
			<note>String</note>
			<version>String</version>
		</list-item>
		<list-item>
			<url>http://www.altova.com/</url>
			<type>String</type>
			<note>String</note>
			<version>String</version>
		</list-item>
	</download>
	<documentation>
		<list-item>
			<url>http://www.altova.com/</url>
			<type>
				<list-item>String</list-item>
				<list-item>String</list-item>
			</type>
			<note>String</note>
		</list-item>
		<list-item>
			<url>http://www.altova.com/</url>
			<type>
				<list-item>String</list-item>
				<list-item>String</list-item>
			</type>
			<note>String</note>
		</list-item>
	</documentation>
	<relation>
		<list-item>
			<biotoolsID>String</biotoolsID>
			<type>String</type>
		</list-item>
		<list-item>
			<biotoolsID>String</biotoolsID>
			<type>String</type>
		</list-item>
	</relation>
	<publication>
		<list-item>
			<doi>String</doi>
			<pmid>String</pmid>
			<pmcid>String</pmcid>
			<type>
				<list-item>String</list-item>
				<list-item>String</list-item>
			</type>
			<version>String</version>
			<note>String</note>
		</list-item>
		<list-item>
			<doi>String</doi>
			<pmid>String</pmid>
			<pmcid>String</pmcid>
			<type>
				<list-item>String</list-item>
				<list-item>String</list-item>
			</type>
			<version>String</version>
			<note>String</note>
		</list-item>
	</publication>
	<credit>
		<list-item>
			<name>String</name>
			<email>String</email>
			<url>http://www.altova.com/</url>
			<orcidid>String</orcidid>
			<gridid>String</gridid>
			<rorid>String</rorid>
			<fundrefid>String</fundrefid>
			<typeEntity>String</typeEntity>
			<typeRole>
				<list-item>String</list-item>
				<list-item>String</list-item>
			</typeRole>
			<note>String</note>
		</list-item>
		<list-item>
			<name>String</name>
			<email>String</email>
			<url>http://www.altova.com/</url>
			<orcidid>String</orcidid>
			<gridid>String</gridid>
			<rorid>String</rorid>
			<fundrefid>String</fundrefid>
			<typeEntity>String</typeEntity>
			<typeRole>
				<list-item>String</list-item>
				<list-item>String</list-item>
			</typeRole>
			<note>String</note>
		</list-item>
	</credit>
</root>
